{
  "schemaVersion": 1,
  "id": "FI-300x100",
  "marketId": "FI",
  "name": "300x100",
  "width": 300,
  "height": 100,
  "mode": "animated",
  "repeat": 0,
  "background": "#070d1d",
  "layers": [
    {
      "id": "hero",
      "name": "Campaign image",
      "type": "image",
      "source": "hero",
      "text": "",
      "x": 0,
      "y": 30,
      "width": 129,
      "height": 51,
      "rotation": 0,
      "opacity": 1,
      "visible": true,
      "fill": "#ffffff",
      "fontSize": 24,
      "minFontSize": 10,
      "maxLines": 3,
      "align": "center",
      "verticalAlign": "middle",
      "textFlow": "manual",
      "textOverride": null,
      "fontWeight": "bold",
      "lineHeight": 1,
      "focalX": 0.5,
      "focalY": 0.5,
      "zoom": 1,
      "fade": 0.6,
      "fadeDirection": "right",
      "radius": 0,
      "stacked": false,
      "glow": {
        "enabled": false,
        "color": "#ff162d",
        "blur": 8,
        "opacity": 0.85
      }
    },
    {
      "id": "logo",
      "name": "NetBet logo",
      "type": "logo",
      "source": "logo",
      "text": "",
      "x": 8,
      "y": 6,
      "width": 51,
      "height": 88,
      "rotation": 0,
      "opacity": 1,
      "visible": true,
      "fill": "#ffffff",
      "fontSize": 24,
      "minFontSize": 10,
      "maxLines": 3,
      "align": "center",
      "verticalAlign": "middle",
      "textFlow": "manual",
      "textOverride": null,
      "fontWeight": "bold",
      "lineHeight": 1,
      "focalX": 0.5,
      "focalY": 0.5,
      "zoom": 1,
      "fade": 0.35,
      "fadeDirection": "top",
      "radius": 0,
      "stacked": true,
      "glow": {
        "enabled": false,
        "color": "#ff162d",
        "blur": 8,
        "opacity": 0.85
      }
    },
    {
      "id": "headline",
      "name": "Headline",
      "type": "text",
      "source": "headline",
      "text": "",
      "x": 95,
      "y": 4,
      "width": 201,
      "height": 41,
      "rotation": 0,
      "opacity": 1,
      "visible": true,
      "fill": "#ffffff",
      "fontSize": 41,
      "minFontSize": 9,
      "maxLines": 2,
      "align": "center",
      "verticalAlign": "middle",
      "textFlow": "auto",
      "textOverride": null,
      "fontWeight": "bold",
      "lineHeight": 1,
      "focalX": 0.5,
      "focalY": 0.5,
      "zoom": 1,
      "fade": 0.35,
      "fadeDirection": "top",
      "radius": 0,
      "stacked": false,
      "glow": {
        "enabled": false,
        "color": "#ff162d",
        "blur": 8,
        "opacity": 0.85
      }
    },
    {
      "id": "subtitle",
      "name": "Offer / subtitle",
      "type": "text",
      "source": "subtitle",
      "text": "",
      "x": 95,
      "y": 4,
      "width": 201,
      "height": 41,
      "rotation": 0,
      "opacity": 1,
      "visible": true,
      "fill": "#ffffff",
      "fontSize": 41,
      "minFontSize": 9,
      "maxLines": 2,
      "align": "center",
      "verticalAlign": "middle",
      "textFlow": "auto",
      "textOverride": null,
      "fontWeight": "bold",
      "lineHeight": 1,
      "focalX": 0.5,
      "focalY": 0.5,
      "zoom": 1,
      "fade": 0.35,
      "fadeDirection": "top",
      "radius": 0,
      "stacked": false,
      "glow": {
        "enabled": false,
        "color": "#ff162d",
        "blur": 8,
        "opacity": 0.85
      }
    },
    {
      "id": "cta",
      "name": "Call to action",
      "type": "button",
      "source": "cta",
      "text": "",
      "x": 132,
      "y": 49,
      "width": 122.99999999999999,
      "height": 24,
      "rotation": 0,
      "opacity": 1,
      "visible": true,
      "fill": "#ef1929",
      "fontSize": 23,
      "minFontSize": 10,
      "maxLines": 3,
      "align": "center",
      "verticalAlign": "middle",
      "textFlow": "manual",
      "textOverride": null,
      "fontWeight": "bold",
      "lineHeight": 1,
      "focalX": 0.5,
      "focalY": 0.5,
      "zoom": 1,
      "fade": 0.35,
      "fadeDirection": "top",
      "radius": 30,
      "stacked": false,
      "glow": {
        "enabled": false,
        "color": "#ff162d",
        "blur": 8,
        "opacity": 0.85
      }
    },
    {
      "id": "legal",
      "name": "Market legal",
      "type": "text",
      "source": "legal",
      "text": "",
      "x": 66,
      "y": 83,
      "width": 228,
      "height": 15,
      "rotation": 0,
      "opacity": 1,
      "visible": true,
      "fill": "#bfc3cc",
      "fontSize": 9,
      "minFontSize": 7,
      "maxLines": 2,
      "align": "center",
      "verticalAlign": "middle",
      "textFlow": "manual",
      "textOverride": null,
      "fontWeight": "normal",
      "lineHeight": 1,
      "focalX": 0.5,
      "focalY": 0.5,
      "zoom": 1,
      "fade": 0.35,
      "fadeDirection": "top",
      "radius": 0,
      "stacked": false,
      "glow": {
        "enabled": false,
        "color": "#ff162d",
        "blur": 8,
        "opacity": 0.85
      }
    }
  ],
  "scenes": [
    {
      "id": "part-1",
      "name": "Introduction",
      "durationMs": 2000,
      "transitionMs": 0,
      "tracks": {
        "hero": {
          "visible": true,
          "startMs": 0,
          "fadeInMs": 0,
          "fadeOutMs": 0,
          "dx": 0,
          "dy": 0
        },
        "logo": {
          "visible": true,
          "startMs": 0,
          "fadeInMs": 0,
          "fadeOutMs": 0,
          "dx": 0,
          "dy": 0
        },
        "headline": {
          "visible": true,
          "startMs": 0,
          "fadeInMs": 0,
          "fadeOutMs": 0,
          "dx": 0,
          "dy": 0
        },
        "subtitle": {
          "visible": false,
          "startMs": 0,
          "fadeInMs": 0,
          "fadeOutMs": 0,
          "dx": 0,
          "dy": 0
        },
        "cta": {
          "visible": true,
          "startMs": 0,
          "fadeInMs": 0,
          "fadeOutMs": 0,
          "dx": 0,
          "dy": 0
        },
        "legal": {
          "visible": true,
          "startMs": 0,
          "fadeInMs": 0,
          "fadeOutMs": 0,
          "dx": 0,
          "dy": 0
        }
      }
    },
    {
      "id": "part-2",
      "name": "The offer",
      "durationMs": 1800,
      "transitionMs": 0,
      "tracks": {
        "hero": {
          "visible": true,
          "startMs": 0,
          "fadeInMs": 0,
          "fadeOutMs": 0,
          "dx": 0,
          "dy": 0
        },
        "logo": {
          "visible": true,
          "startMs": 0,
          "fadeInMs": 0,
          "fadeOutMs": 0,
          "dx": 0,
          "dy": 0
        },
        "headline": {
          "visible": false,
          "startMs": 0,
          "fadeInMs": 0,
          "fadeOutMs": 0,
          "dx": 0,
          "dy": 0
        },
        "subtitle": {
          "visible": true,
          "startMs": 0,
          "fadeInMs": 0,
          "fadeOutMs": 0,
          "dx": 0,
          "dy": 0
        },
        "cta": {
          "visible": true,
          "startMs": 0,
          "fadeInMs": 0,
          "fadeOutMs": 0,
          "dx": 0,
          "dy": 0
        },
        "legal": {
          "visible": true,
          "startMs": 0,
          "fadeInMs": 0,
          "fadeOutMs": 0,
          "dx": 0,
          "dy": 0
        }
      }
    }
  ]
}
