{
  "schemaVersion": 1,
  "id": "UK-320x480",
  "marketId": "UK",
  "name": "320x480",
  "width": 320,
  "height": 480,
  "mode": "static",
  "repeat": 0,
  "background": "#070d1d",
  "layers": [
    {
      "id": "hero",
      "name": "Campaign image",
      "type": "image",
      "source": "hero",
      "text": "",
      "x": 0,
      "y": 264,
      "width": 320,
      "height": 182,
      "rotation": 0,
      "opacity": 1,
      "visible": true,
      "fill": "#ffffff",
      "fontSize": 24,
      "minFontSize": 10,
      "maxLines": 3,
      "align": "center",
      "verticalAlign": "middle",
      "textFlow": "manual",
      "textOverride": null,
      "fontWeight": "bold",
      "lineHeight": 1,
      "focalX": 0.5,
      "focalY": 0.5,
      "zoom": 1,
      "fade": 0.33,
      "fadeDirection": "top",
      "radius": 0,
      "stacked": false,
      "glow": {
        "enabled": false,
        "color": "#ff162d",
        "blur": 8,
        "opacity": 0.85
      }
    },
    {
      "id": "logo",
      "name": "NetBet logo",
      "type": "logo",
      "source": "logo",
      "text": "",
      "x": 48,
      "y": 22,
      "width": 224,
      "height": 41,
      "rotation": 0,
      "opacity": 1,
      "visible": true,
      "fill": "#ffffff",
      "fontSize": 24,
      "minFontSize": 10,
      "maxLines": 3,
      "align": "center",
      "verticalAlign": "middle",
      "textFlow": "manual",
      "textOverride": null,
      "fontWeight": "bold",
      "lineHeight": 1,
      "focalX": 0.5,
      "focalY": 0.5,
      "zoom": 1,
      "fade": 0.35,
      "fadeDirection": "top",
      "radius": 0,
      "stacked": false,
      "glow": {
        "enabled": false,
        "color": "#ff162d",
        "blur": 8,
        "opacity": 0.85
      }
    },
    {
      "id": "headline",
      "name": "Headline",
      "type": "text",
      "source": "headline",
      "text": "",
      "x": 32,
      "y": 84,
      "width": 256,
      "height": 70,
      "rotation": 0,
      "opacity": 1,
      "visible": true,
      "fill": "#ffffff",
      "fontSize": 32.64,
      "minFontSize": 14,
      "maxLines": 3,
      "align": "left",
      "verticalAlign": "middle",
      "textFlow": "manual",
      "textOverride": null,
      "fontWeight": "bold",
      "lineHeight": 1,
      "focalX": 0.5,
      "focalY": 0.5,
      "zoom": 1,
      "fade": 0.35,
      "fadeDirection": "top",
      "radius": 0,
      "stacked": false,
      "glow": {
        "enabled": false,
        "color": "#ff162d",
        "blur": 8,
        "opacity": 0.85
      }
    },
    {
      "id": "subtitle",
      "name": "Offer / subtitle",
      "type": "text",
      "source": "subtitle",
      "text": "",
      "x": 32,
      "y": 168,
      "width": 256,
      "height": 65,
      "rotation": 0,
      "opacity": 1,
      "visible": true,
      "fill": "#ffffff",
      "fontSize": 35.84,
      "minFontSize": 15,
      "maxLines": 2,
      "align": "left",
      "verticalAlign": "middle",
      "textFlow": "manual",
      "textOverride": null,
      "fontWeight": "bold",
      "lineHeight": 1,
      "focalX": 0.5,
      "focalY": 0.5,
      "zoom": 1,
      "fade": 0.35,
      "fadeDirection": "top",
      "radius": 0,
      "stacked": false,
      "glow": {
        "enabled": false,
        "color": "#ff162d",
        "blur": 8,
        "opacity": 0.85
      }
    },
    {
      "id": "cta",
      "name": "Call to action",
      "type": "button",
      "source": "cta",
      "text": "",
      "x": 38,
      "y": 247,
      "width": 243,
      "height": 34,
      "rotation": 0,
      "opacity": 1,
      "visible": true,
      "fill": "#ef1929",
      "fontSize": 20.8,
      "minFontSize": 12,
      "maxLines": 3,
      "align": "center",
      "verticalAlign": "middle",
      "textFlow": "manual",
      "textOverride": null,
      "fontWeight": "bold",
      "lineHeight": 1,
      "focalX": 0.5,
      "focalY": 0.5,
      "zoom": 1,
      "fade": 0.35,
      "fadeDirection": "top",
      "radius": 30,
      "stacked": false,
      "glow": {
        "enabled": false,
        "color": "#ff162d",
        "blur": 8,
        "opacity": 0.85
      }
    },
    {
      "id": "legal",
      "name": "Market legal",
      "type": "text",
      "source": "legal",
      "text": "",
      "x": 8,
      "y": 451,
      "width": 304,
      "height": 24,
      "rotation": 0,
      "opacity": 1,
      "visible": true,
      "fill": "#bfc3cc",
      "fontSize": 10,
      "minFontSize": 8,
      "maxLines": 3,
      "align": "center",
      "verticalAlign": "middle",
      "textFlow": "manual",
      "textOverride": null,
      "fontWeight": "normal",
      "lineHeight": 1,
      "focalX": 0.5,
      "focalY": 0.5,
      "zoom": 1,
      "fade": 0.35,
      "fadeDirection": "top",
      "radius": 0,
      "stacked": false,
      "glow": {
        "enabled": false,
        "color": "#ff162d",
        "blur": 8,
        "opacity": 0.85
      }
    }
  ],
  "scenes": [
    {
      "id": "part-1",
      "name": "Artwork",
      "durationMs": 3000,
      "transitionMs": 0,
      "tracks": {
        "hero": {
          "visible": true,
          "startMs": 0,
          "fadeInMs": 0,
          "fadeOutMs": 0,
          "dx": 0,
          "dy": 0
        },
        "logo": {
          "visible": true,
          "startMs": 0,
          "fadeInMs": 0,
          "fadeOutMs": 0,
          "dx": 0,
          "dy": 0
        },
        "headline": {
          "visible": true,
          "startMs": 0,
          "fadeInMs": 0,
          "fadeOutMs": 0,
          "dx": 0,
          "dy": 0
        },
        "subtitle": {
          "visible": true,
          "startMs": 0,
          "fadeInMs": 0,
          "fadeOutMs": 0,
          "dx": 0,
          "dy": 0
        },
        "cta": {
          "visible": true,
          "startMs": 0,
          "fadeInMs": 0,
          "fadeOutMs": 0,
          "dx": 0,
          "dy": 0
        },
        "legal": {
          "visible": true,
          "startMs": 0,
          "fadeInMs": 0,
          "fadeOutMs": 0,
          "dx": 0,
          "dy": 0
        }
      }
    }
  ]
}
